{
  "$schema": "../../component-meta.schema.json",
  "name": "Grid",
  "description": "Arranges items into responsive columns with one shared gap.",
  "category": "layout",
  "tags": ["grid", "layout", "columns", "responsive"],
  "status": "stable",
  "sourcePath": "src/components/Grid/index.tsx",
  "exportName": "Grid",
  "propsSummary": [
    "children: node",
    "columns: 1|2|3|4|6|12|auto (default: 1)",
    "minChildWidth: string",
    "gap: none|xs|sm|md|lg|xl (default: md)",
    "alignItems: start|center|end|stretch",
    "justifyItems: start|center|end|stretch",
    "className: string",
    "style: object"
  ],
  "props": {
    "children": {
      "type": "node",
      "description": "Grid items and content",
      "required": false
    },
    "columns": {
      "type": "union",
      "description": "Column tracks: a count (1, 2, 3, 4, 6, 12) for that many equal minmax(0, 1fr) tracks, or \"auto\" to fit as many minChildWidth tracks as the width allows. With minChildWidth a count becomes a ceiling that drops tracks as the grid narrows.",
      "default": "1",
      "required": false,
      "values": ["1", "2", "3", "4", "6", "12", "auto"]
    },
    "minChildWidth": {
      "type": "string",
      "description": "Narrowest a track may get, as a CSS length. Defaults to the grid-cell measure for columns=\"auto\"; with a count it turns the count into a ceiling. Measured against the grid's own width, never the viewport.",
      "required": false
    },
    "gap": {
      "type": "enum",
      "description": "Space between tracks on the layout gap scale: 0, 4, 8, 12, 16, 24",
      "default": "md",
      "required": false,
      "values": ["none", "xs", "sm", "md", "lg", "xl"]
    },
    "alignItems": {
      "type": "enum",
      "description": "Vertical alignment of items within their cells",
      "required": false,
      "values": ["start", "center", "end", "stretch"]
    },
    "justifyItems": {
      "type": "enum",
      "description": "Horizontal alignment of items within their cells",
      "required": false,
      "values": ["start", "center", "end", "stretch"]
    },
    "className": {
      "type": "string",
      "description": "Additional class name",
      "required": false
    },
    "style": {
      "type": "object",
      "description": "Inline styles",
      "required": false
    }
  },
  "usage": {
    "when": [
      "Cards, tiles, or media that reflow as their container narrows",
      "Multi-column form layouts",
      "Dashboard widget layouts",
      "Feature mosaics: Grid.Item colSpan and rowSpan around a Card"
    ],
    "whenNot": ["One-directional lists (use Stack)", "Navigation bars (use Header)"],
    "guidelines": [
      "columns=\"auto\" with minChildWidth adapts to the grid's own width",
      "A count plus minChildWidth caps the tracks and drops them as the pane narrows — no viewport breakpoints",
      "gap reads the one layout scale; the shell owns the page gutter and surfaces own their inset, so Grid has no padding",
      "Wrap a child in Grid.Item to span columns; colSpan=\"full\" spans the row",
      "Keep source order equal to visual order — Grid does not reorder for screen readers"
    ],
    "accessibility": [
      "Grid is purely visual — it does not affect reading order or semantics",
      "Ensure logical source order matches visual order for screen readers"
    ]
  },
  "examples": [
    {
      "name": "Default",
      "description": "Three equal tracks.",
      "code": "import { Card } from '@/components/Card';\nimport { Grid } from '@/components/Grid';\n\n<Grid columns={3} gap=\"md\">\n  <Card>One</Card>\n  <Card>Two</Card>\n  <Card>Three</Card>\n</Grid>"
    },
    {
      "name": "Capped Columns",
      "description": "Up to three tracks, never thinner than 14rem; tracks drop as the grid narrows.",
      "code": "import { Card } from '@/components/Card';\nimport { Grid } from '@/components/Grid';\n\n<Grid columns={3} minChildWidth=\"14rem\" gap=\"md\">\n  <Card>One</Card>\n  <Card>Two</Card>\n  <Card>Three</Card>\n</Grid>"
    },
    {
      "name": "Auto-fill",
      "description": "As many tracks as fit at the minimum width.",
      "code": "import { Card } from '@/components/Card';\nimport { Grid } from '@/components/Grid';\n\n<Grid columns=\"auto\" minChildWidth=\"12rem\" gap=\"md\">\n  <Card>One</Card>\n  <Card>Two</Card>\n  <Card>Three</Card>\n  <Card>Four</Card>\n</Grid>"
    },
    {
      "name": "With Spanning",
      "description": "Grid.Item spans columns; colSpan=\"full\" spans the row.",
      "code": "import { Card } from '@/components/Card';\nimport { Grid } from '@/components/Grid';\n\n<Grid columns={4} gap=\"md\">\n  <Grid.Item colSpan={2}>\n    <Card>Spans two</Card>\n  </Grid.Item>\n  <Card>One</Card>\n  <Card>One</Card>\n  <Grid.Item colSpan=\"full\">\n    <Card>Full width</Card>\n  </Grid.Item>\n</Grid>"
    },
    {
      "name": "Form Layout",
      "description": "Two fields side by side, folding to one column below 14rem each.",
      "code": "import { Field } from '@/components/Field';\nimport { Grid } from '@/components/Grid';\nimport { Input } from '@/components/Input';\n\n<Grid columns={2} minChildWidth=\"14rem\" gap=\"md\">\n  <Field>\n    <Field.Label>First name</Field.Label>\n    <Input placeholder=\"Ada\" />\n  </Field>\n  <Field>\n    <Field.Label>Last name</Field.Label>\n    <Input placeholder=\"Lovelace\" />\n  </Field>\n  <Grid.Item colSpan=\"full\">\n    <Field>\n      <Field.Label>Email address</Field.Label>\n      <Input type=\"email\" placeholder=\"ada@example.com\" />\n    </Field>\n  </Grid.Item>\n</Grid>"
    }
  ],
  "relations": [
    {
      "component": "Card",
      "relationship": "child",
      "note": "Grid commonly contains Card components for dashboard and tile layouts"
    },
    {
      "component": "Separator",
      "relationship": "sibling",
      "note": "Use Separator between grid sections"
    }
  ],
  "contract": {
    "propsSummary": [
      "columns: 1|2|3|4|6|12|\"auto\" (default: 1)",
      "minChildWidth: string — narrowest track; turns a count into a ceiling",
      "gap: none|xs|sm|md|lg|xl (default: md)",
      "alignItems: start|center|end|stretch — block-axis alignment",
      "justifyItems: start|center|end|stretch — inline-axis alignment",
      "Pass-through DOM props supported on Grid and Grid.Item roots (id, role, aria-*, data-*, handlers)"
    ]
  },
  "provenance": {
    "source": "migrated",
    "verified": false,
    "frameworkSupport": "native",
    "extractedAt": "2026-03-13T23:18:57.444Z"
  },
  "cssVariables": [],
  "attributes": []
}
