{
  "$schema": "../../component-meta.schema.json",
  "name": "EmptyState",
  "description": "Explains why an area is blank and offers the next step.",
  "category": "feedback",
  "tags": ["empty", "placeholder", "no-data", "zero-state", "blank-slate"],
  "status": "stable",
  "sourcePath": "src/components/EmptyState/index.tsx",
  "exportName": "EmptyState",
  "propsSummary": ["children: node (required)", "size: sm|md (default: md)"],
  "props": {
    "children": {
      "type": "node",
      "description": "EmptyState content - use EmptyState.Icon, EmptyState.Title, EmptyState.Description, EmptyState.Actions sub-components",
      "required": true
    },
    "size": {
      "type": "enum",
      "description": "Padding only: sm for a panel or table body, md for a page region. Type and icon never change with size.",
      "default": "md",
      "required": false,
      "values": ["sm", "md"]
    }
  },
  "usage": {
    "when": [
      "Lists, tables, or search results with nothing to show",
      "First-run screens before any content exists",
      "Filtered views that matched nothing"
    ],
    "whenNot": [
      "Content still loading (use Skeleton)",
      "Failures that need a retry (use Alert)",
      "Transient confirmations (use Toast)"
    ],
    "guidelines": [
      "Say why the area is empty, not just that it is",
      "Give one clear action out of the state; two at most, primary first",
      "Match the icon to the cause: search, inbox, folder",
      "Use size=\"sm\" inside a panel, card or table body and the default md for a page region",
      "The state draws no frame of its own; it sits inside whatever already frames the region",
      "Content is start-aligned with the copy around it"
    ],
    "accessibility": [
      "EmptyState.Title renders a heading (h3 by default); set as to match the outline",
      "EmptyState.Icon is decorative and hidden from assistive tech",
      "Action buttons follow button accessibility guidelines"
    ]
  },
  "examples": [
    {
      "name": "Default",
      "description": "First-run state: nothing exists yet, so offer the create action.",
      "code": "<EmptyState>\n  <EmptyState.Icon><FolderIcon /></EmptyState.Icon>\n  <EmptyState.Title>No projects yet</EmptyState.Title>\n  <EmptyState.Description>Get started by creating your first project.</EmptyState.Description>\n  <EmptyState.Actions>\n    <Button>Create Project</Button>\n  </EmptyState.Actions>\n</EmptyState>"
    },
    {
      "name": "No Results",
      "description": "A filter or query matched nothing — offer a way back.",
      "code": "<EmptyState>\n  <EmptyState.Icon><SearchIcon /></EmptyState.Icon>\n  <EmptyState.Title>No results found</EmptyState.Title>\n  <EmptyState.Description>Try adjusting your search terms or filters.</EmptyState.Description>\n  <EmptyState.Actions>\n    <Button variant=\"soft\">Clear Filters</Button>\n  </EmptyState.Actions>\n</EmptyState>"
    },
    {
      "name": "With Secondary Action",
      "description": "One primary action plus a quieter alternative.",
      "code": "<EmptyState>\n  <EmptyState.Icon><InboxIcon /></EmptyState.Icon>\n  <EmptyState.Title>Inbox is empty</EmptyState.Title>\n  <EmptyState.Description>You have no new messages.</EmptyState.Description>\n  <EmptyState.Actions>\n    <Button>Compose Message</Button>\n    <Button variant=\"soft\">View Archive</Button>\n  </EmptyState.Actions>\n</EmptyState>"
    },
    {
      "name": "Small",
      "description": "Compact padding for a panel or table body; no icon, no action.",
      "code": "<EmptyState size=\"sm\">\n  <EmptyState.Title>No items</EmptyState.Title>\n  <EmptyState.Description>Add items to see them here.</EmptyState.Description>\n</EmptyState>"
    }
  ],
  "relations": [
    {
      "component": "Alert",
      "relationship": "alternative",
      "note": "Use Alert for error states with retry"
    },
    {
      "component": "Progress",
      "relationship": "alternative",
      "note": "Use Progress/Spinner for loading states"
    }
  ],
  "contract": {
    "propsSummary": [
      "size: sm|md (default: md) - padding only",
      "Sub-components: EmptyState.Icon, EmptyState.Title, EmptyState.Description, EmptyState.Actions",
      "Compound sub-components forward DOM props to their rendered elements"
    ],
    "a11yRules": ["A11Y_EMPTY_STATE_CONTENT"]
  },
  "ai": {
    "compositionPattern": "compound",
    "subComponents": ["Icon", "Title", "Description", "Actions"],
    "requiredChildren": ["Title"],
    "commonPatterns": [
      "<EmptyState><EmptyState.Title>{title}</EmptyState.Title><EmptyState.Description>{description}</EmptyState.Description></EmptyState>",
      "<EmptyState><EmptyState.Icon>{icon}</EmptyState.Icon><EmptyState.Title>{title}</EmptyState.Title><EmptyState.Description>{description}</EmptyState.Description><EmptyState.Actions><Button>{action}</Button></EmptyState.Actions></EmptyState>"
    ]
  },
  "provenance": {
    "source": "migrated",
    "verified": false,
    "frameworkSupport": "native",
    "extractedAt": "2026-03-13T23:18:56.922Z"
  },
  "cssVariables": [
    "--fui-bg-secondary",
    "--fui-feedback-empty-max-inline-md",
    "--fui-feedback-empty-max-inline-sm",
    "--fui-feedback-text-gap",
    "--fui-font-sans",
    "--fui-icon-lg",
    "--fui-radius-surface",
    "--fui-raw-space-0",
    "--fui-raw-space-12",
    "--fui-raw-space-16",
    "--fui-raw-space-24",
    "--fui-raw-space-32",
    "--fui-raw-space-4",
    "--fui-raw-space-8",
    "--fui-text-primary",
    "--fui-text-secondary"
  ],
  "attributes": []
}
