{
  "$schema": "../../component-meta.schema.json",
  "name": "Popover",
  "description": "Anchors interactive content to a trigger without blocking the page.",
  "category": "overlays",
  "tags": ["popover", "overlay", "dropdown", "floating", "contextual"],
  "status": "stable",
  "sourcePath": "src/components/Popover/index.tsx",
  "exportName": "Popover",
  "propsSummary": [
    "children: node (required)",
    "open: boolean",
    "defaultOpen: boolean",
    "onOpenChange: function",
    "modal: boolean (default: false)"
  ],
  "props": {
    "children": {
      "type": "node",
      "description": "Popover trigger and content",
      "required": true
    },
    "open": {
      "type": "boolean",
      "description": "Controlled open state",
      "required": false
    },
    "defaultOpen": {
      "type": "boolean",
      "description": "Default open state (uncontrolled)",
      "default": "false",
      "required": false
    },
    "onOpenChange": {
      "type": "function",
      "description": "Called when open state changes",
      "required": false
    },
    "modal": {
      "type": "boolean",
      "description": "Whether to block page interaction",
      "default": "false",
      "required": false
    }
  },
  "usage": {
    "when": [
      "Editing a value in place",
      "Previews richer than a line of text",
      "Filter and picker panels",
      "Content that outgrows a tooltip"
    ],
    "whenNot": [
      "A short hint (use Tooltip)",
      "A list of actions (use Menu)",
      "Anything that must block the page (use Dialog)",
      "Feedback the user does not act on (use Toast or Alert)"
    ],
    "guidelines": [
      "One job per panel",
      "Always give the user a visible way out",
      "Pick a side that does not cover what the user just clicked",
      "Add the arrow when the trigger is not obvious",
      "Pass render={<Button />} (or a link) to Popover.Trigger and Popover.Close"
    ],
    "accessibility": [
      "Focus is moved to popover content on open",
      "Closes on Escape key",
      "Focus returns to trigger on close"
    ]
  },
  "examples": [
    {
      "name": "Default",
      "description": "Title, body, and a close control.",
      "code": "<Popover>\n  <Popover.Trigger render={<Button variant=\"soft\" />}>Open Popover</Popover.Trigger>\n  <Popover.Content>\n    <Popover.Close />\n    <Popover.Title>Popover Title</Popover.Title>\n    <Popover.Description>\n      This is a popover with some content. It can contain text, forms, or other elements.\n    </Popover.Description>\n  </Popover.Content>\n</Popover>"
    },
    {
      "name": "With Form",
      "description": "Enough room to edit a value in place.",
      "code": "<Popover>\n  <Popover.Trigger render={<Button variant=\"soft\" />}>Edit Name</Popover.Trigger>\n  <Popover.Content size=\"sm\">\n    <Popover.Close />\n    <Popover.Title>Edit Name</Popover.Title>\n    <Popover.Body>\n      <Field>\n        <Field.Label>Display Name</Field.Label>\n        <Input placeholder=\"Enter name\" />\n      </Field>\n    </Popover.Body>\n    <Popover.Footer>\n      <Popover.Close render={<Button variant=\"soft\" size=\"sm\" />}>Cancel</Popover.Close>\n      <Button variant=\"solid\" size=\"sm\">Save</Button>\n    </Popover.Footer>\n  </Popover.Content>\n</Popover>"
    },
    {
      "name": "With Arrow",
      "description": "The arrow ties the panel back to its trigger.",
      "code": "<Popover>\n  <Popover.Trigger render={<Button variant=\"soft\" />}>Info</Popover.Trigger>\n  <Popover.Content arrow>\n    <Popover.Title>Quick Tip</Popover.Title>\n    <Popover.Description>\n      This popover has an arrow pointing to its trigger element.\n    </Popover.Description>\n  </Popover.Content>\n</Popover>"
    },
    {
      "name": "Positions",
      "description": "Flips to the opposite side when space runs out.",
      "code": "<div style={{ display: 'flex', gap: '16px', padding: '60px' }}>\n  <Popover>\n    <Popover.Trigger render={<Button variant=\"soft\" />}>Top</Popover.Trigger>\n    <Popover.Content side=\"top\" size=\"sm\">\n      <Popover.Description>Popover on top</Popover.Description>\n    </Popover.Content>\n  </Popover>\n  <Popover>\n    <Popover.Trigger render={<Button variant=\"soft\" />}>Bottom</Popover.Trigger>\n    <Popover.Content side=\"bottom\" size=\"sm\">\n      <Popover.Description>Popover on bottom</Popover.Description>\n    </Popover.Content>\n  </Popover>\n</div>"
    },
    {
      "name": "Link Trigger",
      "description": "render lets a link open it.",
      "code": "<Popover>\n  <Popover.Trigger render={<a href=\"#popover-help\" />}>Open help</Popover.Trigger>\n  <Popover.Content size=\"sm\">\n    <Popover.Description>The trigger renders as a link through render.</Popover.Description>\n  </Popover.Content>\n</Popover>"
    }
  ],
  "relations": [
    {
      "component": "Tooltip",
      "relationship": "alternative",
      "note": "Use Tooltip for brief, non-interactive hints"
    },
    {
      "component": "Menu",
      "relationship": "alternative",
      "note": "Use Menu for action lists"
    },
    {
      "component": "Dialog",
      "relationship": "alternative",
      "note": "Use Dialog for blocking interactions"
    }
  ],
  "contract": {
    "propsSummary": [
      "open: boolean - controlled open state",
      "onOpenChange: (open) => void - state handler",
      "modal: boolean - blocks page interaction (default: false)",
      "Popover.Trigger, Popover.Close render: element - render a library control or a link",
      "Popover.Content size: sm|md - width cap and inset (default: md)",
      "Popover.Content side: top|bottom|left|right (default: bottom); align: start|center|end (default: center)",
      "Popover.Content arrow: boolean - fill-only pointer (default: false)",
      "Popover.Content anchor, positionMethod, container - position against another element or portal elsewhere"
    ],
    "a11yRules": ["A11Y_POPOVER_FOCUS", "A11Y_POPOVER_ESCAPE", "A11Y_TARGET_SIZE_MIN"]
  },
  "ai": {
    "compositionPattern": "compound",
    "subComponents": ["Trigger", "Content", "Close", "Title", "Description", "Body", "Footer"],
    "requiredChildren": ["Trigger", "Content"],
    "commonPatterns": [
      "<Popover><Popover.Trigger render={<Button variant=\"soft\" />}>Open</Popover.Trigger><Popover.Content><Popover.Close /><Popover.Title>{title}</Popover.Title><Popover.Description>{description}</Popover.Description></Popover.Content></Popover>",
      "<Popover><Popover.Trigger render={<a href=\"#help\" />}>Open help</Popover.Trigger><Popover.Content>...</Popover.Content></Popover>"
    ]
  },
  "provenance": {
    "source": "migrated",
    "verified": false,
    "frameworkSupport": "native",
    "extractedAt": "2026-03-13T23:19:02.154Z"
  },
  "cssVariables": [
    "--fui-bg-elevated",
    "--fui-feedback-text-gap",
    "--fui-overlay-arrow-size",
    "--fui-overlay-layer-anchored",
    "--fui-overlay-section-gap",
    "--fui-raw-space-0",
    "--fui-raw-space-10",
    "--fui-raw-space-4",
    "--fui-raw-space-8",
    "--fui-text-primary",
    "--fui-text-secondary"
  ],
  "attributes": [
    {
      "name": "data-size",
      "value": "md",
      "fixture": "populated"
    }
  ]
}
